{
  "$schema": "../defaults/guardrails.schema.json",
  "description": "Example per-project .agents/guardrails.json configuration.",
  "deny_paths": [
    ".env",
    "secrets/",
    "backups/"
  ],
  "ask_write_paths": [
    ".agents/"
  ],
  "deny_commands": [
    {
      "pattern": "\\bdocker(?:\\s+compose|-compose)\\b[^\\n;|&]*\\bdown\\b[^\\n;|&]*(?:-v\\b|--volumes\\b)",
      "reason": "Destroying named Docker volumes with `down -v` is blocked."
    }
  ],
  "ask_commands": [
    {
      "pattern": "\\bdocker(?:\\s+compose|-compose)\\s+(?:up|down|stop|restart|rm|kill)\\b",
      "reason": "Starting, stopping, or recreating Docker Compose services requires confirmation."
    }
  ],
  "allow_commands": [
    "^cd\\s+(?:backend|frontend)$",
    "^(?:\\.venv/bin/|uv\\s+run\\s+)?(?:pytest|ruff)\\b",
    "^npm\\s+(?:test|run\\s+build|run\\s+lint|ci)\\b",
    "^docker(?:\\s+compose|-compose)\\s+(?:ps|logs|build|config|exec|run)\\b"
  ]
}
